{
  "id": "wickham_keep",
  "region": "vale",
  "name": "Wickham Keep",
  "levels": "3–6",
  "floors": 2,
  "hidden": true,
  "summary": "An imperial keep on the Wickham road, the Redhand Company's hold, with cellars that go down into older stone.",
  "shut": "The gate is barred from inside, and somebody up on the wall laughs at you."
}
