{
  "id": "toadking_mound",
  "region": "fens",
  "name": "Toadking's Mound",
  "levels": "8–11",
  "floors": 2,
  "summary": "An island in the mere, built up out of stolen boats. The Toadking's reed-cutters hold it, and the Boat Hall underneath: forty hulls on their sides, and something living in each."
}
