{
  "id": "sunken_chapel",
  "region": "vale",
  "name": "The Sunken Chapel",
  "levels": "7–9",
  "floors": 3,
  "summary": "An imperial chapel half-swallowed by the river marsh: the Nave under water, the Cult's Cut where somebody has been digging, and the Binding Crypt below, where the legion was bound and its Standard still stands."
}
