{
  "id": "sickpools",
  "region": "fens",
  "name": "The Sickpools",
  "levels": "10–13",
  "floors": 2,
  "summary": "Imperial vats in the reeds east of the canal, still leaking something green into the fen. Nobody remembers what they brewed. Vat Seven has been drained, and there's a ladder down."
}
