{
  "id": "mere_tower",
  "region": "fens",
  "name": "The Mere Tower",
  "levels": "12",
  "floors": 1,
  "summary": "A black tower that stood up out of the Mere when the lake went down, older than the empire. The stair goes on and nobody has found the top. Wenna Pike rows companies out from Saltmere's jetty; the climb pays at every tenth landing."
}
