{
  "id": "canal_locks",
  "region": "fens",
  "name": "The Canal Locks",
  "levels": "13–15",
  "floors": 3,
  "summary": "The lock-keepers' halls on the drowned canal. Below them is the Sluice, where the bound lock-men lie in rows with their windlasses, and under that Vat Seven, the old Sickpools, where the Vatwarden keeps the sluice."
}
